{
  "case_id": "CASE-9002",
  "added": "2026-07-24",
  "patient": {
    "id": "PT-DEMO",
    "age": 58,
    "sex": "F",
    "clinical_context": "SYNTHETIC EXAMPLE — no real patient. Illustrates a follow-up study six months after CASE-9001."
  },
  "study": {
    "region": "abdomen",
    "study_date": "2026-07-06",
    "contrast": "portal_venous",
    "slice_thickness_mm": 5,
    "technique_notes": "Fabricated record used to demonstrate the schema and the compare command."
  },
  "frames": [
    {
      "id": "portal-venous-axial",
      "image": null,
      "plane": "axial",
      "window": "soft_tissue",
      "slice_level": "porta hepatis",
      "notes": null
    }
  ],
  "findings": [
    {
      "id": "liver-seg7-lesion",
      "organ": "liver",
      "laterality": "right",
      "location": "segment VII",
      "description": "Same segment VII lesion, now larger with a thicker enhancing rim and a lower-density centre.",
      "size_mm": [
        31,
        27,
        25
      ],
      "attenuation_hu": {
        "value": 30,
        "min": null,
        "max": null,
        "qualitative": "hypodense"
      },
      "margins": "lobulated",
      "enhancement": "rim",
      "morphology": [
        "solid",
        "rim-enhancing",
        "necrotic"
      ],
      "significance": "significant",
      "certainty": "definite",
      "seen_on": [
        "portal-venous-axial"
      ]
    },
    {
      "id": "liver-seg2-cyst",
      "organ": "liver",
      "laterality": "left",
      "location": "segment II",
      "description": "Unchanged well-defined water-density lesion.",
      "size_mm": [
        9
      ],
      "attenuation_hu": {
        "value": 7,
        "min": null,
        "max": null,
        "qualitative": "fluid"
      },
      "margins": "well_defined",
      "enhancement": "none",
      "morphology": [
        "cystic"
      ],
      "significance": "benign",
      "certainty": "probable",
      "seen_on": [
        "portal-venous-axial"
      ]
    },
    {
      "id": "portacaval-node",
      "organ": "lymph node",
      "laterality": "n/a",
      "location": "portacaval station",
      "description": "Rounded portacaval node, newly conspicuous, with loss of the fatty hilum.",
      "size_mm": [
        13,
        11
      ],
      "attenuation_hu": {
        "value": 45,
        "min": null,
        "max": null,
        "qualitative": "soft_tissue"
      },
      "margins": "well_defined",
      "enhancement": "homogeneous",
      "morphology": [
        "solid"
      ],
      "significance": "significant",
      "certainty": "definite",
      "seen_on": [
        "portal-venous-axial"
      ]
    }
  ],
  "impression": "Interval enlargement of the segment VII hepatic lesion with central necrosis, plus a new enlarged portacaval node. The segment II cyst is unchanged.",
  "differential": [
    {
      "entity": "Progressive metastatic disease",
      "supporting": [
        "Lesion growth with central necrosis",
        "New enlarged regional node"
      ],
      "against": [
        "No primary identified on the supplied frame"
      ],
      "likelihood": "high"
    }
  ],
  "confidence": "low",
  "limitations": [
    "Synthetic record — not derived from a real study.",
    "Single frame; nodal short axis and full nodal survey not assessable."
  ],
  "compare_to": [
    "CASE-9001"
  ],
  "tags": [
    "example",
    "synthetic",
    "follow-up",
    "hepatic-lesion"
  ],
  "notes": "Demonstration data. Run: CTDECK_CASES=examples python3 tools/ctdeck.py compare CASE-9001 CASE-9002"
}
